#,Company Name,About,Outreach Insight,Headline,Top Opportunity,Brief URL,Slug,Review Status,Notes,OK to send?
608,StowHere!,"Marketplace matching vehicle and boat storage seekers with garage, driveway, and dock hosts.","StowHere! asks renters to trust hosts with valuable vehicles before storage ends, offering as little as 1-day bookings. Upstory could help rebuild booking and host verification flows if StowHere! is relaunching after contraction.",We believe we can help StowHere! move more storage searches into booked spaces.,Make search lead to a booking.,https://clients.upstory.co/stowhere,stowhere,Ship,P3 — send when contact found,Yes
609,StreetEasy,"New York real estate marketplace with verified listings for buyers, sellers, and renters.","StreetEasy helps renters and buyers commit to major housing decisions and leases before living outcomes are known. Upstory could help optimize renter onboarding, listing verification disclosure, and application flows within Zillow's NYC brand.",We believe we can help StreetEasy move more renters from a search into a submitted application.,Make search lead to an application.,https://clients.upstory.co/streeteasy,streeteasy,Ship,P2 — send when contact found,Yes
610,Strollby,"Travel planning platform curating hotel deals, packages, and activities for booking.",Strollby asks travelers to purchase trips before experiencing destinations through curated deals and packages. Upstory could help refine package discovery and booking checkout flows.,We believe we can help Strollby move more travelers from discovery into a booked package.,Make discovery lead to a booking.,https://clients.upstory.co/strollby,strollby,Ship,P3 — send when contact found,Yes
611,Stylere,On-demand fashion delivery platform connecting shoppers with local retailers for same-day delivery.,"Stylere asks shoppers to commit to purchases and same-day delivery before receiving and trying items from local retailers. Upstory could help optimize checkout, pickup scheduling, and delivery tracking flows as Stylere expands markets.",We believe we can help Stylere move more shoppers from a search into a same-day delivered order.,Make the first order easy and fast.,https://clients.upstory.co/stylere,stylere,Ship,P3 — send when contact found,Yes
612,SugarPulse,Early-stage health-tech venture using innovative approaches to improve quality of life for people with diabetes.,Insufficient signal for a specific angle; fit is on trust category and product description only. SugarPulse targets people managing diabetes who must share health-related commitment before long-term quality-of-life benefits are clear.,We believe we can help SugarPulse move more new users into an active diabetes-management routine.,Make onboarding lead to a routine.,https://clients.upstory.co/sugarpulse,sugarpulse,Ship,P4 — send when contact found,Yes
613,Sunbook.ca 日光记旅游平台,North American travel platform offering vacation packages to tropical destinations.,Sunbook asks travelers to prepay vacation packages before the experience occurs across tropical getaways. Upstory could help optimize package discovery and booking checkout flows as Sunbook scales headcount and destination coverage.,We believe we can help Sunbook.ca move more travelers from discovery into a booked package.,Make discovery lead to a booking.,https://clients.upstory.co/sunbookca,sunbookca,Ship,P3 — send when contact found,Yes
614,Sunlight,Child-welfare platform connecting families and professionals to coordinate cases and reunify families sooner.,Sunlight wants child welfare teams to coordinate cases securely to speed reunification. Families and attorneys share sensitive information on invite-only Your Case Plan before outcomes improve. Upstory could help agency onboarding and family-facing messaging flows.,We believe we can help Sunlight move more child-welfare teams into active case coordination.,Make joining a case plan simple.,https://clients.upstory.co/sunlight,sunlight,Ship,P3 — send when contact found,Yes
615,Superscript,Consumer healthcare shopping platform where people build carts of services with upfront prices.,"Superscript is letting consumers build healthcare carts and pay upfront prices before receiving treatment, a novel enrollment moment in US healthcare. Upstory could help design patient checkout and service selection flows that make upfront-priced care feel trustworthy and complete.",We believe we can help Superscript move more visitors from a cart into a paid healthcare purchase.,Make the cart lead to a purchase.,https://clients.upstory.co/superscript,superscript,Ship,P2 — send when contact found,Yes
616,SuperStable,"Stablecoin-driven platform for cross-border remittance, payroll, and business payments.",SuperStable asks users to send money internationally through stablecoins before recipients confirm receipt and value. Upstory could help design remittance onboarding and transfer confirmation flows if SuperStable is actively building consumer UX.,We believe we can help SuperStable move more new users from signup into a first completed transfer.,Make the first transfer reachable.,https://clients.upstory.co/superstable,superstable,Ship,P3 — send when contact found,Yes
617,SurePass,"ID verification software and hardware for law enforcement, schools, and venues.",SurePass asks venues and patrons to authenticate IDs before granting entry and alcohol service. Upstory could help refine patron-facing verification and venue setup flows that reduce friction at high-traffic checkpoints.,We believe we can help SurePass move more venues into a first live verification workflow.,Make setup lead to live verification.,https://clients.upstory.co/surepass,surepass,Ship,P3 — send when contact found,Yes
618,Surftunnels,VPN service providing Iranian IP addresses so diaspora users can access banking and government portals.,"Surftunnels asks users to trust the VPN with identity and traffic routing before privacy protection is confirmed, specifically for accessing Iranian banking and government portals. Upstory could help optimize subscription and OpenVPN setup onboarding.",We believe we can help Surftunnels move more new users to a first successful connection.,Make setup lead to a first connection.,https://clients.upstory.co/surftunnels,surftunnels,Ship,P3 — send when contact found,Yes
619,Svvy,Quiz-based marketplace that matches women with vetted financial advisors.,Svvy wants women to feel confident choosing vetted advisors for wealth and investment decisions through a short quiz. The commitment moment is sharing financial goals and entrusting an advisor relationship before outcomes are known. Upstory could help Svvy improve quiz-to-match onboarding and advisor interview application flows for both sides of the marketplace.,We believe we can help Svvy move more women from the matching quiz to a connected advisor.,Make the quiz lead to a confident match.,https://clients.upstory.co/svvy,svvy,Ship,P3 — send when contact found,Yes
620,Sweeten,Renovation marketplace matching homeowners with vetted contractors and project guidance.,Sweeten matches homeowners with vetted contractors for major renovations where families trust property and budget before projects finish. Upstory could help optimize homeowner intake and contractor matching flows to maintain deal volume during headcount contraction.,We believe we can help Sweeten move more renovation intakes to contractor-ready project briefs.,Guide homeowners to a contractor-ready brief.,https://clients.upstory.co/sweeten,sweeten,Ship,P1 — send when contact found,Yes
621,SwiftReload Group,"Multi-brand fintech serving migrants with top-up, wallet, and cross-border payment services.","SwiftReload asks migrants and freelancers to trust borderless payments and wallets before every transfer succeeds. Upstory could help design wallet setup and cross-border transfer flows across SwiftReload, SarafWallet, and related brands.",We believe we can help SwiftReload Group move more new users from signup into a first completed transfer.,Make wallet setup lead to a transfer.,https://clients.upstory.co/swiftreload-group,swiftreload-group,Ship,P2 — send when contact found,Yes
622,Symlex VPN,"Consumer VPN service offering high-speed, secure connections to a large global user base.","Symlex VPN asks subscribers to route traffic through encrypted tunnels before privacy benefits are experienced, with 10M+ total subscriptions. Upstory could help improve subscription and multi-device setup onboarding to convert free to paid users.","We believe we can help Symlex VPN move more free users into paid, multi-device subscriptions.",Make free-to-paid lead to multi-device use.,https://clients.upstory.co/symlex-vpn,symlex-vpn,Ship,P3 — send when contact found,Yes
623,Syndio Health,Community-led platform for people with chronic illness to share information and participate in research.,Syndio Health asks members to contribute sensitive health experiences and participate in research before support benefits arrive. Upstory could help design community enrollment and research participation flows for chronic illness members.,We believe we can help Syndio Health move more members into active community participation.,Make joining lead to a first contribution.,https://clients.upstory.co/syndio-health,syndio-health,Ship,P3 — send when contact found,Yes
624,SystMade,Antivirus and internet security software company offering consumer device protection suites.,SystMade asks consumers to install internet security and trust the vendor with device protection before browsing safely. Upstory could help refine free trial and installation onboarding for SystMade Internet Security and Total Security products.,"We believe we can help SystMade move more trials into active, protected devices.",Make install lead to active protection.,https://clients.upstory.co/systmade,systmade,Ship,P3 — send when contact found,Yes
625,Tailor Brands,"AI business-building platform for LLC formation, branding, websites, and compliance tasks.","Tailor Brands asks aspiring owners to commit to legal entity formation, registered agents, and compliance steps before ventures prove viable. Upstory could help optimize the Guidance Engine onboarding where users form LLCs and set up business infrastructure through AI-powered flows.",We believe we can help Tailor Brands increase LLC formation starts that reach state filing submission.,Show the formation roadmap before checkout.,https://clients.upstory.co/tailor-brands,tailor-brands,Ship,P1 — send when contact found,Yes
626,Taksio Technologies,Rideshare app matching riders with local drivers for private transport in minutes.,Taksio asks riders to commit to transportation with local drivers before the trip experience. Upstory could help refine rider and driver app onboarding for a growing private transport network.,We believe we can help Taksio move more new riders to a completed first trip.,Make the first ride easy to book.,https://clients.upstory.co/taksio-technologies,taksio-technologies,Ship,P3 — send when contact found,Yes
627,Talos Health,Digital health company building AI support tools for family caregivers.,"Talos Health asks family caregivers to adopt AI support for loved ones before knowing whether coaching and coordination improve outcomes. Upstory could help design caregiver enrollment and consent flows across emotional support, paperwork, and care coordination tools.",We believe we can help Talos Health move more caregivers into an active support tool.,Make enrollment lead to active support.,https://clients.upstory.co/talos-health,talos-health,Ship,P3 — send when contact found,Yes
628,Tandem,AI platform improving medication access by automating prior authorizations and pharmacy coordination.,"Tandem asks patients to commit to therapy access pathways before medicines prove effective, automating prior auth with 75% higher approval rates cited. Upstory could help design patient-facing enrollment and prescription concierge flows as Tandem scales specialty practice adoption.",We believe we can help Tandem move more patients from a prescription into started therapy.,Make enrollment lead to started therapy.,https://clients.upstory.co/tandem,tandem,Ship,P2 — send when contact found,Yes
629,Tara Global Technology,All-in-one transport app in the Philippines for renting cars and booking logistics trucks.,Insufficient signal for a specific angle; fit is on trust category and product description only. Tara lets users rent cars and book logistics trucks before trips and deliveries occur.,We believe we can help Tara Global Technology move more users from a search into a booked vehicle.,Make the first booking easy.,https://clients.upstory.co/tara-global-technology,tara-global-technology,Ship,P4 — send when contact found,Yes
630,TargaMED,"HIPAA-compliant telehealth and patient management platform spanning scheduling, transport, pharma, and DME.","TargaMED asks patients to commit to telehealth care pathways before treatment delivery is proven across scheduling, transport, and pharma services. Upstory could help design patient intake and telehealth enrollment flows.",We believe we can help TargaMED move more patients from intake into a started care pathway.,Make intake lead to a started pathway.,https://clients.upstory.co/targamed,targamed,Ship,P3 — send when contact found,Yes
631,Tarme,"Wearable health startup with a device tracking vitals, GPS, and hydration for health and safety.","TARME asks users to trust wearable health and environmental monitoring before clinical or safety insights arrive through the B.3 device. Upstory could help design device setup and alert enrollment flows for athletes, caregivers, and at-risk users.",We believe we can help Tarme move more buyers from setup into active health monitoring.,Make setup lead to active monitoring.,https://clients.upstory.co/tarme,tarme,Ship,P3 — send when contact found,Yes
632,TBoost AI,"AI automotive assistant for car search, smart diagnostics, and repair insights.",Insufficient signal for a specific angle; fit is on trust category and product description only. TBoost AI helps car buyers commit to major vehicle decisions relying on AI guidance before outcomes.,We believe we can help TBoost AI move more users from a first query into an acted-on recommendation.,Make a first query lead to a recommendation.,https://clients.upstory.co/tboost-ai,tboost-ai,Ship,P4 — send when contact found,Yes
633,Teams Delivery,Medical delivery service offering climate-controlled transport and verified handoffs across the GTA.,Teams Delivery asks pharmacies and patients to trust medical delivery before medicines arrive safely with climate control and OTP verification. Upstory could help design patient and pharmacy booking flows for same-day and emergency delivery.,We believe we can help Teams Delivery move more patients and pharmacies into a first completed delivery.,Make ordering lead to a delivery.,https://clients.upstory.co/teams-delivery,teams-delivery,Ship,P3 — send when contact found,Yes
634,TeamStake,Online platform for managing fantasy sports league finances with payment collection and payouts.,"TeamStake asks fantasy league members to commit entry fees and trust payout distribution before seasons conclude. Upstory could help optimize league setup, payment collection, and payout enrollment flows.",We believe we can help TeamStake move more leagues from setup into collected entry fees.,Make league setup lead to collected fees.,https://clients.upstory.co/teamstake,teamstake,Ship,P3 — send when contact found,Yes
635,TeleHealthSherpa,Telehealth comparison service matching patients and professionals with telehealth providers.,Insufficient signal for a specific angle; fit is on trust category and product description only. TeleHealthSherpa asks patients to choose telehealth providers before care quality is established.,We believe we can help TeleHealthSherpa move more patients from a comparison into a chosen provider.,Make comparison lead to a chosen provider.,https://clients.upstory.co/telehealthsherpa,telehealthsherpa,Ship,P4 — send when contact found,Yes
636,Tentrr,Marketplace for booking private campsites and customized outdoor experiences on private land.,"Tentrr asks campers to book private campsites and customized outdoor experiences before the trip happens. Upstory could help refine discovery, customization, and booking checkout flows for experience-led camping.",We believe we can help Tentrr move more campers from discovery into a booked campsite.,Make discovery lead to a booking.,https://clients.upstory.co/tentrr,tentrr,Ship,P2 — send when contact found,Yes
637,The Dyrt,"Camping subscription platform with campground reviews and booking, plus a PRO membership tier.","The Dyrt asks campers to subscribe to PRO and book campgrounds before trips, with 8M+ reviews and 30M annual visits. Upstory could help optimize PRO subscription enrollment and campground booking flows that drive the rapid PRO signup rate.",We believe we can help The Dyrt move more campers from free use into PRO subscription and booking.,Make free use lead to PRO and a booking.,https://clients.upstory.co/the-dyrt,the-dyrt,Ship,P2 — send when contact found,Yes
638,The Realest,Authenticated entertainment memorabilia marketplace sourcing collectibles from artists and athletes.,The Realest asks collectors to commit large sums to authenticated memorabilia before independent verification confirms authenticity. Upstory could help design collector onboarding and purchase flows that reinforce trust in cutting-edge authentication technology.,We believe we can help The Realest move more collector views to authenticated purchase starts.,Put provenance into the item decision.,https://clients.upstory.co/the-realest,the-realest,Ship,P1 — send when contact found,Yes
639,Thea,"Personal data management app providing a secure, centralized place for important information.","Thea is trying to grow adoption where described as a company where thea is a personal data management application that provides a secure and centralized location for your most important information. Upstory could help Thea clarify verification, setup, and secure-sharing flows at first use.",We believe we can help Thea move more new users to a first secured set of information.,Make the first items easy to store.,https://clients.upstory.co/thea,thea,Ship,P3 — send when contact found,Yes
640,thePro Nextdoor,"Service helping homeowners find verified contractors with photos, videos, and neighbor references.",thePro Nextdoor asks consumers to hire home service professionals based on verified references before work is completed. Upstory could help optimize contractor discovery and reference review flows that drive hiring decisions.,We believe we can help thePro Nextdoor move more homeowners from discovery into a hired contractor.,Make discovery lead to a hire.,https://clients.upstory.co/thepro-nextdoor,thepro-nextdoor,Ship,P3 — send when contact found,Yes
641,TicketMonster,Service helping California drivers fight traffic tickets by written declaration in minutes.,Insufficient signal for a specific angle; fit is on trust category and product description only. TicketMonster asks drivers to contest citations through written declarations before legal outcomes are final.,We believe we can help TicketMonster move more drivers from a start into a submitted declaration.,Make starting lead to a submitted declaration.,https://clients.upstory.co/ticketmonster,ticketmonster,Ship,P4 — send when contact found,Yes
642,Tidalwave,"AI mortgage platform for borrower applications, verification, underwriting, and lender workflows.","Tidalwave asks homebuyers to commit financial documents and loan terms at application before the mortgage and home purchase fully close. Upstory could help design borrower-facing application and AI guidance flows, including Spanish-language support, as Tidalwave scales post-raise.",We believe we can help Tidalwave move more borrower starts to application-ready loan files.,Show the loan file path before document upload.,https://clients.upstory.co/tidalwave,tidalwave,Ship,P1 — send when contact found,Yes
643,Tinker DIY,Platform connecting drivers with ASE-certified mechanics for live video second opinions.,Tinker DIY helps car owners get trusted second opinions before authorizing expensive repairs through on-demand video calls with ASE-certified mechanics. Upstory could help optimize app onboarding and pre-repair consultation flows that drive consultation bookings.,We believe we can help Tinker DIY move more drivers from signup into a booked consultation.,Make onboarding lead to a consultation.,https://clients.upstory.co/tinker-diy,tinker-diy,Ship,P3 — send when contact found,Yes
644,Token of Trust,"Identity verification, fraud prevention, and compliance platform serving ecommerce, education, and healthcare across many countries.",Token of Trust asks consumers to expose verified identity and reputation data to third parties before receiving the benefit of trusted transactions. Upstory could help refine consumer identity wallet setup and merchant integration onboarding flows.,We believe we can help Token of Trust move more consumers through a first completed verification.,Make wallet setup lead to a verification.,https://clients.upstory.co/token-of-trust,token-of-trust,Ship,P3 — send when contact found,Yes
645,TomoCredit,AI credit underwriting platform improving credit access for new-to-credit and underserved populations.,TomoCredit asks consumers to seek credit based on proprietary ML scoring before borrowing outcomes are known. Upstory could help design credit application and onboarding flows that build confidence for underserved borrowers in San Francisco.,We believe we can help TomoCredit move more applicants from signup into an approved credit product.,Make the application lead to approval.,https://clients.upstory.co/tomocredit,tomocredit,Ship,P2 — send when contact found,Yes
646,Total Hearing Care,"Provider of hearing exams, hearing aids, and rehabilitative services for hearing health.",Total Hearing Care asks patients to commit to medical hearing care and devices before knowing treatment results. Upstory could help design patient intake and hearing aid enrollment flows if the company is building digital patient experiences.,We believe we can help Total Hearing Care move more patients from inquiry into a booked exam.,Make booking an exam easy.,https://clients.upstory.co/total-hearing-care,total-hearing-care,Ship,P3 — send when contact found,Yes
647,Tourch Ride,Houston rideshare app with a driver-friendly model that lets drivers keep most of the fare.,Tourch Ride asks riders to enter drivers' vehicles based on app matching before trip completion. Upstory could help refine rider and driver onboarding that emphasizes safety and the 80% driver fare model during contraction.,We believe we can help Tourch Ride move more new riders to a completed first trip.,Make the first ride easy and reassuring.,https://clients.upstory.co/tourch-ride,tourch-ride,Ship,P3 — send when contact found,Yes
648,TourHero,Community-led group travel platform empowering hosts to plan and run trips across many destinations.,TourHero asks participants to commit to group travel with hosts before the trip experience unfolds across 80+ destinations. Upstory could help design host trip launch and participant payment flows that reduce friction in community-led travel.,We believe we can help TourHero move more participants from a trip into a committed booking.,Make a trip lead to a committed booking.,https://clients.upstory.co/tourhero,tourhero,Ship,P2 — send when contact found,Yes
649,TradeOS,"Coding platform for independent stock, forex, and commodities traders to build and deploy strategies.",TradeOS asks retail traders to deploy automated strategies and capital before market outcomes are known. Upstory could help design trader onboarding and strategy deployment flows for the coding platform.,We believe we can help TradeOS move more new traders from signup into a first deployed strategy.,Make onboarding lead to a deployed strategy.,https://clients.upstory.co/tradeos,tradeos,Ship,P3 — send when contact found,Yes
650,Transporterr,"Luxury transportation service for executives, officials, athletes, and celebrities.",Transporterr asks high-profile clients to trust chauffeurs with personal safety before trips complete. Upstory could help design booking and client verification flows for luxury transportation services.,We believe we can help Transporterr move more clients from a request into a booked ride.,Make the request lead to a booking.,https://clients.upstory.co/transporterr,transporterr,Ship,P3 — send when contact found,Yes
651,Travel Inti,Travel planning platform with curated destination recommendations and flight and hotel comparison.,Insufficient signal for a specific angle; fit is on trust category and product description only. Travel Inti asks travelers to book trips and contact businesses directly with discounts before travel occurs.,We believe we can help Travel Inti move more travelers from planning into a booked trip.,Make planning lead to a booking.,https://clients.upstory.co/travel-inti,travel-inti,Ship,P4 — send when contact found,Yes
652,TRCare,Digital health platform connecting people with physical disabilities to licensed therapists for movement therapy.,TRCare asks members to commit to movement therapy treatment before mobility outcomes improve through remote PT and OT sessions. Upstory could help design patient enrollment and therapist matching flows.,We believe we can help TRCare move more members from enrollment into active movement therapy.,Make enrollment lead to a first session.,https://clients.upstory.co/trcare,trcare,Ship,P3 — send when contact found,Yes
