#,Company Name,About,Outreach Insight,Headline,Top Opportunity,Brief URL,Slug,Review Status,Notes,OK to send?
176,DocTrackr,Document-security software that lets users control who can access sensitive documents after they are sent.,"docTrackr built its brand on letting people control who accesses sensitive documents after send, a moment where users grant access and sharing rules before they see outcomes. If the team still shapes consumer or SMB-facing controls, the external opportunity is clarifying setup, permission, and sharing flows so users do not abandon encryption tools as too complex. Upstory could support docTrackr on those high-stakes document handoff screens if product investment continues under the parent company.",We believe we can help DocTrackr move more users from a first document to active access controls.,Make setting access controls simple.,https://clients.upstory.co/doctrackr,doctrackr,Ship,P2 — send when contact found,Yes
177,Doctronic,AI-native medical visit platform combining symptom conversations with physician oversight.,"Doctronic is moving fast to make AI primary care accessible at a fraction of traditional cost while keeping human physician guardrails. Patients start visits and share symptoms online before diagnoses and treatment plans are proven, so visit-start, triage, and follow-through UX directly affect completion and retention. Upstory could help Doctronic define repeatable onboarding and visit flows for new user cohorts and enterprise partners so each launch does not reinvent the first-consultation experience.",We believe we can help Doctronic move more symptom starts to completed care next steps.,Explain the care path before symptom detail.,https://clients.upstory.co/doctronic,doctronic,Ship,P1 — send when contact found,Yes
178,DocuHome,Home inventory and disaster-preparedness software for cataloging assets and storing critical documents.,"DocuHome wants families and businesses to build visual home inventories and vault critical documents before a fire, flood, or other calamity proves the value. Users commit sensitive home and medical records upfront when motivation is abstract, which makes first-upload and catalog completion the conversion bottleneck. Upstory could help DocuHome shape onboarding that gets users through initial room-by-room capture and secure indexing without dropping off mid-inventory.",We believe we can help DocuHome move more new users to a first completed room inventory.,Make the first room easy to capture.,https://clients.upstory.co/docuhome,docuhome,Ship,P2 — send when contact found,Yes
179,DogCancer,Veterinarian-backed resource helping dog owners make informed canine cancer care decisions.,"DogCancer.com is trying to give pet owners confident, vet-backed guidance at diagnosis when outcomes are still unknown. Owners research treatment and care choices under emotional load, so the moments where they subscribe, save a care plan, or contact a professional path matter for trust and retention. Upstory could help DogCancer.com design clearer first-visit journeys from search to sustained engagement so anxious owners do not bounce after a single article.",We believe we can help DogCancer move more first-time visitors into sustained engagement.,Make the first visit lead somewhere.,https://clients.upstory.co/dogcancer,dogcancer,Ship,P3 — send when contact found,Yes
180,Doob Dash Delivery,"Cannabis delivery app connecting licensed dispensaries, couriers, and adult consumers across medical and recreational markets.","Doob Dash is working to make cannabis ordering feel as effortless as food delivery while keeping compliance and courier reliability tight. Adults place regulated orders and grant address access before product and delivery quality are proven, and dispensaries onboard inventory before demand materializes. Upstory could help Doob Dash refine consumer checkout, age verification, and first-order onboarding plus dispensary listing flows that determine whether new markets activate quickly.",We believe we can help Doob Dash Delivery move more new users to a first completed compliant order.,Make the first order easy and compliant.,https://clients.upstory.co/doob-dash-delivery,doob-dash-delivery,Ship,P3 — send when contact found,Yes
181,Doola,Business-in-a-box platform for international founders forming and operating U.S. companies.,"doola wants founders worldwide to form and run a U.S. business in a few clicks, linking entity creation, banking, tax, and compliance before the LLC proves commercially successful. The commitment moment is early: users pay and file legal steps while still uncertain about U.S. market fit. Upstory could help doola streamline formation checkout, EIN and banking setup, and first-dashboard tasks so more international founders complete launch instead of stalling after payment.",We believe we can help Doola move more founder signups to completed business launch tasks.,Turn formation checkout into a launch roadmap.,https://clients.upstory.co/doola,doola,Ship,P1 — send when contact found,Yes
182,Door,"Building intelligence and smart access platform with hardware, software, and services for multifamily and commercial properties.","Door is trying to put operators and residents in control of building and service experiences, whether that is providers managing jobs on their terms or properties consolidating access and automation. Users commit to providers, schedules, or building permissions before service quality is proven, so scheduling, invoicing, and resident-facing setup flows shape retention. Upstory could help Door clarify consumer and provider onboarding for whichever surface is actively launching, reducing drop-off when someone first connects payment, access, or a service booking.",We believe we can help Door move more properties to a first active access or service setup.,Make first setup lead to active use.,https://clients.upstory.co/door,door,Ship,P2 — send when contact found,Yes
183,Doorkee,"Peer-to-peer rental platform connecting departing tenants, apartment seekers, and landlords without broker fees.","Doorkee wants to make urban apartment transfers broker-free by connecting departing tenants, seekers, and landlords in one digital flow. Renters tour and apply while landlords rely on tenant-led handoffs before vacancy savings are realized, so tour booking, application, and payout transparency drive conversion. Upstory could help Doorkee polish seeker and departing-tenant onboarding for new cities so more posted units convert to signed leases without broker friction.",We believe we can help Doorkee move more posted units into signed leases.,Make tour-to-application smooth.,https://clients.upstory.co/doorkee,doorkee,Ship,P2 — send when contact found,Yes
184,DOZR,Online marketplace bringing e-commerce to heavy equipment rental for contractors and rental companies.,"DOZR is trying to make heavy equipment rental as transparent and online as consumer e-commerce for contractors and rental companies. Renters book bulldozers and fleets before job-site performance is proven, and suppliers launch WebStores before incremental revenue shows up. Upstory could help DOZR improve renter search-to-checkout and supplier storefront onboarding so more bookings complete online without phone tag.",We believe we can help DOZR move more equipment searches into completed online bookings.,Make search lead to online checkout.,https://clients.upstory.co/dozr,dozr,Ship,P2 — send when contact found,Yes
185,DriveClub,"Auto savings membership bundling oil changes, washes, gas cash-back, and roadside assistance through a digital platform.","DriveClub wants drivers to join a membership and prepay for bundled car care before they experience savings across providers. The join-and-link-provider moment determines whether members activate benefits like free oil changes and gas cashback. Upstory could help DriveClub tighten membership signup, payment, and first-redemption flows so new members use benefits in the first thirty days.",We believe we can help DriveClub move more new members to a first redeemed benefit.,Make signup lead to a first redemption.,https://clients.upstory.co/driveclub,driveclub,Ship,P4 — send when contact found,Yes
186,Driver Technologies,"AI mobility app that turns smartphones into dash cams with collision alerts, telematics, and insurance discounts.","Driver Technologies wants drivers to enable camera-based safety and share telematics before premium savings and claims outcomes are finalized. Users opt into recording, permissions, and DriverScore sharing upfront when privacy stakes feel high. Upstory could help Driver Technologies simplify first-trip enablement and insurer-link onboarding so more users reach discount eligibility without abandoning setup.",We believe we can help Driver Technologies move more new users to a first recorded trip and linked score.,Make first-trip enablement easy.,https://clients.upstory.co/driver-technologies,driver-technologies,Ship,P2 — send when contact found,Yes
187,Driverless,Peer-to-peer autonomous transportation logistics network using driver-assistance systems and idle vehicles.,Driverless aims to build the first peer-to-peer fully autonomous transportation logistics network leveraging ADAS and partnered providers. Users and partners must commit routes and vehicles before autonomous delivery proves reliable. Upstory could help them design shipper and driver onboarding for early network participation as they move from vision to live logistics.,We believe we can help Driverless move more partners into early network participation.,Make early participation easy to start.,https://clients.upstory.co/driverless,driverless,Ship,P3 — send when contact found,Yes
188,DriverOnTap,Service providing designated drivers who get people home safely in their own vehicle.,"DriverOnTap wants people to book a stranger to drive their personal car home safely when they cannot drive. Riders commit location access and vehicle handoff before the trip ends, so booking, driver match, and in-trip reassurance drive completion. Upstory could help DriverOnTap polish panic and planned booking flows so more nighttime users finish a ride instead of defaulting to rideshare without their car.",We believe we can help DriverOnTap move more nighttime users to a completed ride home.,Make panic and planned booking fast.,https://clients.upstory.co/driverontap,driverontap,Ship,P2 — send when contact found,Yes
189,Durin,Context-aware smart access system for homes and landlords with automatic entry and threshold awareness.,"Durin wants homeowners and landlords to adopt intelligent access that unlocks automatically and flags unfamiliar activity at the threshold. Users grant home access and identity signals before daily reliability is proven, so initial device setup, household enrollment, and alert preferences are the adoption bottleneck. Upstory could help Durin design setup and household onboarding that feels effortless rather than another security app pile-on.",We believe we can help Durin move more new owners to a first effortless entry setup.,Make setup feel effortless.,https://clients.upstory.co/durin,durin,Ship,P3 — send when contact found,Yes
190,DwellSafe,Clinician-led home safety platform combining AI-assisted assessments with clinical review for value-based care.,DwellSafe wants health delivery organizations to adopt AI-assisted home assessments with clinical review before outcomes improve. Patients and care teams share home risk data and accept interventions ahead of proven fall reduction. Upstory could help DwellSafe shape patient and clinician onboarding inside care management workflows so assessments start faster and follow-up plans stick.,We believe we can help DwellSafe move more patients into a completed home assessment.,Make the first assessment easy to start.,https://clients.upstory.co/dwellsafe,dwellsafe,Ship,P3 — send when contact found,Yes
191,Dwellsy,Free organic rental search marketplace with verified listings and free landlord posting at national scale.,"Dwellsy is trying to transform rentals with truthful search, fraud-resistant listings, and free landlord posting at national scale. Renters commit time and applications before they trust a listing, and managers list units before lease velocity proves out. Upstory could help Dwellsy sharpen renter search-to-apply and landlord free-listing onboarding so verified inventory converts faster.",We believe we can help Dwellsy move more renters from search to a submitted application.,Make search lead to an application.,https://clients.upstory.co/dwellsy,dwellsy,Ship,P2 — send when contact found,Yes
192,eBodyGuard,"Personal safety apps and city safety programs connecting individuals, law enforcement, and communities.","eBodyGuard wants individuals and cities to adopt electronic safety tools with 911 connectivity, GPS, and evidence capture during vulnerable moments. Users enable location and recording permissions before an incident proves the system works, so first-time setup and emergency activation UX drive adoption. Upstory could help eBodyGuard streamline citizen onboarding and city program enrollment so more installs become active safety profiles.",We believe we can help eBodyGuard move more installs into active safety profiles.,Make setup lead to an active profile.,https://clients.upstory.co/ebodyguard,ebodyguard,Ship,P3 — send when contact found,Yes
193,Echo AR,AI mental health chatbot offering conversational support for stress and anxiety.,"Echo users disclose stress and anxiety to an AI companion before therapeutic benefit is established. Upstory could help them design safe, credible first-session onboarding for mental health chat.",We believe we can help Echo AR move more new users into a first supportive conversation.,Make the first conversation feel safe.,https://clients.upstory.co/echo-ar,echo-ar,Ship,P3 — send when contact found,Yes
194,Educare Academy,Licensed child development centers serving children from six weeks to twelve years with family collaboration.,"Educare Academy wants families to enroll children in licensed care with confidence in health, safety, and education before daily experience proves the fit. Parents share child health and developmental information during intake when stakes feel personal. Upstory could help Educare Academy refine family enrollment and communication journeys if they productize digital intake across centers.",We believe we can help Educare Academy move more families from inquiry to a completed enrollment.,Make enrollment feel reassuring.,https://clients.upstory.co/educare-academy,educare-academy,Ship,P3 — send when contact found,Yes
195,eForms,DIY legal forms platform offering low-cost templates across all fifty states by subscription.,"eForms wants consumers and businesses to self-serve legal documents affordably without paying for attorney bundles they do not need. Users select, pay, and file templates before outcomes are certain, so form selection, checkout, and completion flows determine revenue. Upstory could help eForms improve category-to-checkout journeys for high-stakes forms like employment, loans, and real estate agreements.",We believe we can help eForms move more visitors from a form category to a completed document.,Make category-to-checkout smooth.,https://clients.upstory.co/eforms,eforms,Ship,P3 — send when contact found,Yes
196,eFuneral Partner,Digital funeral planning platform powering online arrangement and purchasing for hundreds of funeral homes.,"eFuneral Partner helps funeral firms let families plan arrangements and purchases online from home before services are delivered. Families choose packages and pay while grief and time pressure are high, so transparent arrangement selection and digital checkout shape completion. Upstory could help eFuneral Partner refine family-facing planning and payment flows that funeral homes embed as their branded digital storefront.",We believe we can help eFuneral Partner move more families from planning into a completed online arrangement.,Make arrangement-to-payment compassionate.,https://clients.upstory.co/efuneral-partner,efuneral-partner,Ship,P2 — send when contact found,Yes
197,Eirene Cremations,"End-of-life resource hub offering pre-planning guidance, grief support, and memorial information for families.","Eirene is trying to give families clear, compassionate end-of-life guidance through Eirene.life after moving beyond pure cremation operations. Families explore pre-planning and grief resources before every service detail is known, so education-to-action paths matter for trust. Upstory could help Eirene design decision-support flows that move readers from articles into confident pre-planning steps without feeling sales-driven.",We believe we can help Eirene move more readers from resources into confident pre-planning steps.,Make resources lead to a first step.,https://clients.upstory.co/eirene-cremations,eirene-cremations,Ship,P3 — send when contact found,Yes
198,Eli Technologies,Electrification incentive platform for contractors and homeowners accessing rebates and financing.,Eli Technologies wants contractors and homeowners to access rebates and financing before energy savings materialize. Homeowners and installers commit project details and applications upfront when program rules feel complex. Upstory could help Eli Technologies simplify homeowner eligibility screening and contractor embed flows so more upgrades start and finish with incentives attached.,We believe we can help Eli Technologies move more upgrade leads to incentive-ready applications.,Make eligibility clear inside contractor workflows.,https://clients.upstory.co/eli-technologies,eli-technologies,Ship,P1 — send when contact found,Yes
199,ELYS Health,"Membership longevity platform combining premium diagnostics, clinician oversight, and home-delivered therapies.","ELYS wants members to subscribe to clarity on longevity through premium diagnostics, personalized protocols, and ongoing telehealth rather than buying labs alone. Members commit membership and health data before interventions prove healthspan gains, so enrollment, diagnostic scheduling, and protocol onboarding are the critical moments. Upstory could help ELYS HEALTH package a repeatable member onboarding playbook as headcount surges.",We believe we can help ELYS Health move more members from enrollment to an active longevity protocol.,Make enrollment lead to a protocol.,https://clients.upstory.co/elys-health,elys-health,Ship,P3 — send when contact found,Yes
200,Emovid,"Visual verification platform for sending human-authenticated, tamper-tracked messages across video, audio, and text.","Emovid is trying to restore confidence in digital messages by having users send verified, tamper-tracked communications before recipients know the channel is safe. If the go-to-market is active, first-send setup and recipient verification flows determine adoption. Fit is on the identity-oriented product description only until team and growth signals are enriched.",We believe we can help Emovid move more new users to a first verified message sent.,Make the first verified send simple.,https://clients.upstory.co/emovid,emovid,Ship,P4 — send when contact found,Yes
201,Empathos AI,"Neurodivergent-support tools spanning AR glasses, biometrics, caregiver insights, and an assistant for daily independence.","Empathos AI wants neurodivergent users and caregivers to adopt Shared Eyes, Shared Heart, and Shared Circles before daily independence gains are proven. Device pairing, caregiver consent, and care-access journeys carry health and privacy stakes at first use. Upstory could help Empathos AI simplify caregiver-and-user onboarding for whichever module is closest to launch once leadership is identified.",We believe we can help Empathos AI move more users and caregivers to a first active support setup.,Make first setup feel supportive.,https://clients.upstory.co/empathos-ai,empathos-ai,Ship,P4 — send when contact found,Yes
202,Empathy,"Digital support platform for bereavement, estate tasks, legacy planning, and life transitions.","Empathy is expanding compassionate digital support for bereavement, estate tasks, and legacy planning through Fortune 500 and insurer channels. Families and employees open accounts and share sensitive documents before caseworkers prove outcomes, so first-week care plan activation drives employer ROI. Upstory could help Empathy standardize enrollment and task-completion flows for each new partner rollout so scale does not dilute experience quality.",We believe we can help Empathy move more partner enrollments to completed first care plans.,Create a calmer first care-plan moment.,https://clients.upstory.co/empathy,empathy,Ship,P1 — send when contact found,Yes
203,Empower,Rideshare software that lets drivers set rates and riders choose drivers for local trips.,"Empower is scaling software that lets drivers set rates and riders pick trusted drivers at lower cost than Uber or Lyft. Riders enter a vehicle and authorize payment before the trip proves safe and affordable, and drivers onboard before earnings stabilize. Upstory could help Empower refine rider request and driver onboarding flows so more first trips convert to repeat use in each market.",We believe we can help Empower move more first ride requests to completed repeatable trips.,Explain driver choice inside the request flow.,https://clients.upstory.co/empower,empower,Ship,P1 — send when contact found,Yes
204,Encrypt.me,Consumer VPN app that automatically secures connections on unsafe networks.,"Encrypt.me wants people to install VPN protection that activates on risky networks before users feel a breach. Install, permission, and auto-connect moments determine whether subscribers keep protection on. Upstory could help Encrypt.me refine first-install and network-permission onboarding so more trials become daily active protection.",We believe we can help Encrypt.me move more trials into daily active protection.,Make first install lead to active protection.,https://clients.upstory.co/encryptme,encryptme,Ship,P2 — send when contact found,Yes
205,Enlocked,"Encrypted email service that adds a secured-send button across Outlook, Gmail, and mobile.","Enlocked wants senders to hit a secured button beside normal send so sensitive email stays protected without key exchange. Users must trust Enlocked with message content before delivery is confirmed secure, so plugin install and first secured send are the adoption cliff. Upstory could help Enlocked streamline Outlook and Gmail plugin onboarding and recipient experience for non-Enlocked inboxes.",We believe we can help Enlocked move more new users to a first secured email sent.,Make plugin install lead to a first send.,https://clients.upstory.co/enlocked,enlocked,Ship,P2 — send when contact found,Yes
206,Equalh,Prop-trading funding model that partners with traders instead of relying on repeated challenge fees.,Equalh wants traders to join a funding partnership without paying repeated challenge fees typical of prop firms. Traders commit capital rules and evaluation steps before withdrawals prove the model. Upstory could only help if Equalh runs a consumer-facing evaluation and onboarding product; otherwise fit is weak for product-experience work.,We believe we can help Equalh move more new traders into a started funding evaluation.,Make starting an evaluation clear.,https://clients.upstory.co/equalh,equalh,Ship,P3 — send when contact found,Yes
207,Equitar,"Certified intelligent digital health platform positioning toward unified, accessible care.","equitar is positioning a certified digital health platform for accelerated universal care, but public detail on the exact patient journey is thin. If patients enroll in digital workflows before outcomes are clear, onboarding and care navigation UX will matter once the product surface is clarified. Upstory engagement should wait for enrichment on the actual consumer or provider app being sold.",We believe we can help Equitar move more new users into a first active care workflow.,Make the first workflow easy to start.,https://clients.upstory.co/equitar,equitar,Ship,P3 — send when contact found,Yes
208,Eqvista,"Cap table and 409A valuation platform serving founders, shareholders, and investors with real-time valuations.","Eqvista wants founders to trust instant 409A and cap table decisions backed by NACVA analysts without waiting weeks for static reports. Founders and shareholders commit equity and tax filings with legal permanence before audit outcomes play out, so onboarding, 409A checkout, and cap table migration are high-stakes UX. Upstory could help Eqvista polish founder onboarding from spreadsheet import through first 409A delivery and QSBS attestation steps.",We believe we can help Eqvista move more founders from onboarding to a first delivered 409A.,Make onboarding lead to a first 409A.,https://clients.upstory.co/eqvista,eqvista,Ship,P2 — send when contact found,Yes
209,Erase,Online reputation management service improving search visibility and reducing harmful content for clients.,"Erase.com helps individuals and businesses commit to reputation programs before search results improve. Clients authorize access and pay for audits and remediation while outcomes remain uncertain, so intake, scope agreement, and early reporting shape retention. Upstory could help Erase.com productize client onboarding and progress dashboards that reduce drop-off after signup.",We believe we can help Erase move more signups into an active reputation program.,Make intake lead to an active program.,https://clients.upstory.co/erase,erase,Ship,P2 — send when contact found,Yes
