#,Company Name,About,Outreach Insight,Headline,Top Opportunity,Brief URL,Slug,Review Status,Notes,OK to send?
1,104,On-demand platform that books and confirms professional crews within ninety-nine minutes.,Insufficient signal for a specific angle; fit is on trust category and product description only. 104 App users commit to crews arriving on tight timelines before work quality is shown.,We believe we can help 104 move more clients from a request into a confirmed crew booking.,Make the request lead to a fast confirmation.,https://clients.upstory.co/104,104,Ship,P4 — send when contact found,Yes
2,10Adventures,"Adventure travel marketplace for booking customizable hiking, cycling, and active vacations.","10Adventures wants travelers to book customizable multi-day hiking, cycling, and adventure holidays where they pay and commit itineraries before the trip proves out. High-leverage UX sits in trip customization, deposit or payment checkout, and pre-departure confidence for self-guided and group departures. Upstory could help refine booking and pre-trip onboarding that increases completed reservations and repeat travelers across 1,200+ tours.",We believe we can help 10Adventures move more custom trip inquiries to deposit-ready itineraries.,Make the itinerary preview feel complete before deposit.,https://clients.upstory.co/10adventures,10adventures,Ship,P1 — send when contact found,Yes
3,1502,"Bitcoin-native messaging app combining private chat, payments, billing, and services in one ecosystem.","1502.app LLC is building a Bitcoin-only messenger where users link payments, billing, and services before the full communication suite feels indispensable. The decisive moments are wallet connect, first payment or bill action, and trusting private messaging alongside money movement. Upstory could help streamline first-week onboarding that gets users from download to first successful in-app payment without dropping at permissions or funding steps.",We believe we can help 1502 move more new installs to a first completed in-app payment.,Make the path to a first payment visible at install.,https://clients.upstory.co/1502,1502,Ship,P3 — send when contact found,Yes
4,1P Algorithms,Subscription platform offering AI-driven trading strategies and live trading sessions for futures and options.,"1P Algorithms wants traders at all levels to subscribe to AI-driven strategies and live sessions before capital at risk proves performance. The commitment moment is account setup, strategy selection, and first live or automated trade participation despite disclosed market risk. Upstory could help clarify onboarding and in-product education paths that improve activation into paid sessions without overpromising returns.",We believe we can help 1P Algorithms move more new signups into active paid trading sessions.,Make the first session reachable from signup.,https://clients.upstory.co/1p-algorithms,1p-algorithms,Ship,P4 — send when contact found,Yes
5,360Ofme,Personal data exchange that lets consumers grant and manage data access with businesses.,"360ofme wants consumers and ethical businesses to participate in a personal data exchange where people grant data access before transparent value is clear. The high-stakes moment is consent, sharing scope, and first data connection between consumer and business. Upstory could help design clearer consumer enrollment and business-facing exchange flows that improve completion and repeat participation on a smaller team.",We believe we can help 360Ofme move more new consumers to a first completed data connection.,Show the value before asking for access.,https://clients.upstory.co/360ofme,360ofme,Ship,P2 — send when contact found,Yes
6,3Dapartment,Virtual rental platform for touring apartments in 3D and signing leases online without an in-person visit.,"3DAPARTMENT wants renters to find, tour, apply, and sign leases online before ever visiting a unit, and agents to publish 3D scans quickly. The high-stakes moments are virtual tour engagement, online application, and digital lease execution without in-person reassurance. Upstory could help streamline renter onboarding and application flows that increase completed leases from immersive tours.",We believe we can help 3Dapartment move more virtual tours to completed online lease signings.,Carry tour confidence into the application.,https://clients.upstory.co/3dapartment,3dapartment,Ship,P2 — send when contact found,Yes
7,4Ruedas,Spanish-language marketplace for buying and selling new and used vehicles through verified listings.,"Insufficient signal for a specific angle; fit is on trust category and product description only, though 4ruedas aims to connect real buyers and sellers for vehicle deals before in-person inspection. No revenue, hiring, or funding cues are available to sharpen timing.",We believe we can help 4Ruedas move more vehicle views into started buyer-seller negotiations.,Make listings carry negotiation-ready detail.,https://clients.upstory.co/4ruedas,4ruedas,Ship,P4 — send when contact found,Yes
8,4Stay,Marketplace connecting students and interns with verified off-campus furnished housing for medium-term stays.,4stay is trying to make off-campus housing booking feel effortless for students and institutional partners across one-month to one-year stays. The high-leverage user experience is the path from search to confirmed booking before a renter has seen the unit or completed the stay. Upstory could help 4stay sharpen onboarding and checkout flows for students and white-label institutional portals so more searches convert to committed reservations.,We believe we can help 4Stay move more housing searches into confirmed bookings.,Make the listing feel bookable at a glance.,https://clients.upstory.co/4stay,4stay,Ship,P2 — send when contact found,Yes
9,AdhereTech,Connected medication adherence platform with smart pill bottles and real-time support for pharma and pharmacy programs.,"AdhereTech wants patients and care teams to stay on prescribed regimens by committing to connected bottles and real-time adherence programs before outcomes improve. Growth likely depends on making enrollment, device setup, and two-way dosing support feel effortless for patients and scalable for pharma sponsors. Upstory could help refine patient onboarding and in-app intervention flows that drive first-week adherence activation and program retention for manufacturer partners.",We believe we can help AdhereTech move more enrolled patients to first-week adherence activation.,Make device setup effortless at enrollment.,https://clients.upstory.co/adheretech,adheretech,Ship,P2 — send when contact found,Yes
10,Adia Health,Diagnostic platform combining clinical AI recommendations with instant provider payment in the same visit.,"Adia Health is trying to get clinicians and lab partners to adopt an end-to-end diagnostic workflow where AI recommendations and instant payment land in the same visit, before providers see full revenue and accuracy gains. The conversion moment is when a practice or hospital commits to routing orders and payment through Adia instead of legacy CDS and billing stacks. Upstory could help sharpen provider onboarding, order-path clarity, and patient-facing explanations so more sites activate the platform and complete first paid diagnostic journeys.",We believe we can help Adia Health move more provider sites to a first completed paid diagnostic journey.,Make the first order path unmistakable.,https://clients.upstory.co/adia-health,adia-health,Ship,P3 — send when contact found,Yes
11,Adult Family Home Solutions,Service helping families find licensed adult family homes and schedule tours for elder care.,"Adult Family Home Solutions wants families to tour state-licensed adult family homes and choose care before knowing day-to-day quality. The commitment moments are search, provider contact, and tour booking for a loved one's living situation. Upstory could help improve family-facing search, tour scheduling, and post-tour follow-up UX that increases completed placements across their provider network.",We believe we can help Adult Family Home Solutions move more family searches into booked tours.,Make the path to a tour feel guided.,https://clients.upstory.co/adult-family-home-solutions,adult-family-home-solutions,Ship,P3 — send when contact found,Yes
12,Advocate,"Disability benefits application platform for SSDI, SSI, and veterans claims.",Advocate helps disabled workers share health and work history to pursue benefits before claims resolve. Upstory could help them design eligibility check and document collection flows where applicants commit sensitive information early.,We believe we can help Advocate move more eligible applicants to complete claim packets.,Show the claim path before document collection.,https://clients.upstory.co/advocate,advocate,Ship,P1 — send when contact found,Yes
13,Africa Vision Card,"Reloadable multi-currency card for adding, spending, and transferring money across several currencies.","Insufficient signal for a specific angle; fit is on trust category and product description only. Africa Vision Card users must load and transfer funds across up to five currencies before spending outcomes are proven, which is a natural onboarding and activation design moment if the company is actively acquiring cardholders.",We believe we can help Africa Vision Card move more new cardholders to a first funded and used card.,Make the first load feel simple.,https://clients.upstory.co/africa-vision-card,africa-vision-card,Ship,P4 — send when contact found,Yes
14,Afrikan e Bank,Digital banking and international payments platform for small and medium businesses.,"Afrikan e Bank wants small and medium businesses to adopt its fintech stack and international payments before transfer and operating advantages materialize. Onboarding for business accounts, cross-border payments, and trust in a newer bank alternative are the commitment moments. Upstory could help design SMB signup and first-payment flows that reduce drop-off for businesses moving off legacy banking.",We believe we can help Afrikan e Bank move more business signups to a first completed payment.,Make business onboarding feel dependable.,https://clients.upstory.co/afrikan-e-bank,afrikan-e-bank,Ship,P3 — send when contact found,Yes
15,Ahara Med,Weight program combining GLP-1 medication with personalized nutrition from a registered dietitian.,"Ahara wants consumers to start GLP-1 medication and personalized nutrition programs before long-term weight outcomes are proven. Enrollment, clinical intake, and dietitian matching are the moments where users decide whether to trust a combined med plus nutrition path. Upstory could help tighten patient onboarding and ongoing program UX that improves starts and retention after recent funding on a much smaller team.",We believe we can help Ahara Med move more new patients from enrollment to a started program.,Make intake feel like progress toward care.,https://clients.upstory.co/ahara-med,ahara-med,Ship,P2 — send when contact found,Yes
16,AiCare,AI-driven health platform that predicts and supports patient outcomes through data and community.,AiCare is trying to help patients and communities act on predicted outcomes before treatment results are known. The outward-facing moment is enrollment and data sharing where users commit health context to AI-driven pathways. Upstory could help AiCare design clearer patient onboarding and consent-forward flows that improve activation into ongoing care engagement.,We believe we can help AiCare move more new patients to ongoing care engagement.,Lead with consent-forward enrollment.,https://clients.upstory.co/aicare,aicare,Ship,P2 — send when contact found,Yes
17,AiMining Technologies,"AI infrastructure company positioning high-performance, partner-backed AI services with a retail-investor money angle.","AiMining Technologies positions around trustworthy AI infrastructure, but public copy does not spell out a single consumer commitment moment. If the Awake Conscious Money retail investor angle in ICP context is live, the outreach hook is helping users commit capital and stewardship choices with clearer onboarding. Otherwise treat as insufficient product specificity for a tailored pitch.",We believe we can help AiMining Technologies move more interested visitors to a clear first commitment step.,Define the first commitment step.,https://clients.upstory.co/aimining-technologies,aimining-technologies,Ship,P3 — send when contact found,Yes
18,AIR California,Adventure flight school offering instructional tandem paragliding and hang gliding at Torrey Pines.,Insufficient signal for a specific angle; fit is on trust category and product description only. Customers book tandem flights committing to aerial activity before the experience delivers.,We believe we can help AIR California move more inquiries into booked tandem flights.,Make inquiry lead to a booked flight.,https://clients.upstory.co/air-california,air-california,Ship,P4 — send when contact found,Yes
19,Airmule,On-board courier marketplace connecting travelers' spare luggage space with shippers for express global delivery.,"Airmule wants shippers to choose traveler-based delivery as a faster, affordable alternative to traditional express. The conversion moment is when a sender commits a valuable package and payment before the traveler completes the trip. Upstory could help Airmule improve shipper and traveler onboarding, screening disclosures, and booking checkout so more matches complete the handoff.",We believe we can help Airmule move more shipment requests into completed traveler matches.,Make the match feel dependable.,https://clients.upstory.co/airmule,airmule,Ship,P2 — send when contact found,Yes
20,AirportShuttles,"Marketplace for booking airport transfers across vans, sedans, limos, and ride-hail in one place.","AirportShuttles.com wants travelers to compare vans, sedans, limos, and ride-hail in one flow and book airport transfers instantly. The commitment moment is reserving a vehicle and provider before the trip, when anxiety about timing and price is highest. Upstory could help polish traveler comparison and booking onboarding and the supplier-facing reservation tools that affect completion rates.",We believe we can help AirportShuttles move more transfer searches into completed bookings.,Make multi-modal comparison easy to act on.,https://clients.upstory.co/airportshuttles,airportshuttles,Ship,P2 — send when contact found,Yes
21,Alamesa,"All-in-one Cuban dining platform for restaurant reviews, reservations, food ordering, and culinary experiences.","alamesa is building a one-stop Cuba dining stack where users reserve, order, and book experiences before the meal happens. The activation levers are restaurant signup, diner checkout, and reservation confirmation flows across a fragmented local market. Upstory could help alamesa tighten diner onboarding and payment or reservation completion on mobile apps.",We believe we can help Alamesa move more diners from browsing to confirmed reservations and orders.,Make discovery lead to a confirmed action.,https://clients.upstory.co/alamesa,alamesa,Ship,P3 — send when contact found,Yes
22,Amaise,Agentic AI platform for bodily injury claims processing and insurance underwriting decisions.,"amaise wants carriers, TPAs, and law firms to adopt agentic AI for injury and life underwriting decisions faster and more accurately. The user experience wedge is where adjusters and underwriters first connect claims files and approve AI recommendations before outcomes are known. Upstory could help amaise design carrier onboarding and in-workflow decision screens that improve adoption and retention of the agenticAI platform.",We believe we can help Amaise move more carrier and TPA sites to a first AI-assisted decision.,Make the first decision path clear.,https://clients.upstory.co/amaise,amaise,Ship,P3 — send when contact found,Yes
23,AnchorFree,"Consumer VPN maker behind Hotspot Shield, providing private and secure internet access at global scale.","AnchorFree wants new and returning users to trust Hotspot Shield with their connection before browsing freely, including 400,000 daily downloads cited in Clay. Free-to-paid VPN onboarding, permission, and server selection are the moments that determine retention and upgrade. Upstory could help refine first-session connect flows and paywall transitions that improve activation without undermining privacy positioning on a globally distributed app.",We believe we can help AnchorFree move more new installs to an activated first session.,Make the first connect effortless.,https://clients.upstory.co/anchorfree,anchorfree,Ship,P2 — send when contact found,Yes
24,Andiago,AI-powered concierge that recommends and books hard-to-get restaurant reservations and culinary itineraries.,"Andiago Concierge wants travelers to book hard-to-get tables and itineraries before they arrive in a city. The conversion moment is when a member trusts Andiago to secure a reservation or adjust plans last minute without seeing the restaurant experience yet. Upstory could help Andiago refine member onboarding, preference capture, and booking confirmation flows that drive repeat concierge use.",We believe we can help Andiago move more new members to a first confirmed booking.,Make the first booking quick to reach.,https://clients.upstory.co/andiago,andiago,Ship,P3 — send when contact found,Yes
25,Angel Oak,"Direct-to-consumer life insurance offering fast, affordable coverage for working Americans.",Angel Oak wants working Americans to complete life insurance applications and premium commitments before policy value is ever proven. Upstory could help them streamline quote-to-bind flows where trust in speed and clarity drives completion.,We believe we can help Angel Oak move more applicants from a quote into a bound policy.,Make quote-to-bind seamless.,https://clients.upstory.co/angel-oak,angel-oak,Ship,P3 — send when contact found,Yes
26,Annves,Crypto trading platform with staking and interest products for individuals and institutions.,"Annves is trying to make crypto trading, staking, and interest products accessible through a user-friendly interface with strong security positioning. Users commit funds to trades and staking before returns are proven, so onboarding, KYC, and first-deposit flows are the critical experience. Upstory could help Annves improve activation from signup through first trade or stake without requiring insider funnel data.",We believe we can help Annves move more new signups to a first completed trade or stake.,Make signup-to-first-trade one path.,https://clients.upstory.co/annves,annves,Ship,P3 — send when contact found,Yes
27,Anonabox,Maker of plug-and-play hardware routers that anonymize browsing over Tor or VPN.,"Anonabox wants buyers to trust a pocket router to cloak browsing via Tor or VPN with no software install. The commitment moment is purchasing and plugging in a device before users know anonymity will work on public WiFi or censored networks. Upstory could help Anonabox sharpen ecommerce onboarding, setup education, and first-connection success flows that reduce returns and support load.",We believe we can help Anonabox move more buyers to a first successful device connection.,Make first setup feel foolproof.,https://clients.upstory.co/anonabox,anonabox,Ship,P2 — send when contact found,Yes
28,Anonygo,"Anonymous, location-based photo app that lets people post without linking content to their identity.","Anonygo is trying to grow usage of an anonymous location-based photo app where users post before they are confident identity stays separated from content. The critical product moments are first install permissions, location sharing, and posting flows where users decide whether anonymity feels credible. Upstory could help tighten first-session onboarding and posting UX to improve activation and repeat posts without weakening privacy positioning.",We believe we can help Anonygo move more installs to a first posted photo.,Make the first post feel safe and quick.,https://clients.upstory.co/anonygo,anonygo,Ship,P3 — send when contact found,Yes
29,ApartmentHomeLiving,Apartment rental search platform that matches renters to listings by lifestyle across a large floorplan database.,"ApartmentHomeLiving.com wants renters to treat apartment hunting as a lifestyle match, not a transactional chore, across a huge hourly-updated inventory. Users commit to tours and lease decisions before living in the unit, so search, lifestyle quiz, and apply flows matter for conversion. Upstory could help refine renter onboarding and neighbor-connect features that move visitors from browse to serious lease intent.",We believe we can help ApartmentHomeLiving move more visitors from browsing to serious lease intent.,Turn lifestyle matching into a clear next step.,https://clients.upstory.co/apartmenthomeliving,apartmenthomeliving,Ship,P2 — send when contact found,Yes
30,ApproXie Urgent Care,Mobile platform for booking same-day in-person or virtual urgent care visits with local providers.,"ApproXie wants patients to request same-day face-to-face or virtual urgent care and for provider systems to capture demand with less wait time. Patients commit symptoms, location, and appointment choice before care is delivered; providers need fast routing and satisfaction gains. Upstory could help define patient booking and virtual visit onboarding that scales as headcount triples over 24 months and new markets come online.",We believe we can help ApproXie move more patients from request to a completed urgent visit.,Make booking a visit fast under pressure.,https://clients.upstory.co/approxie-urgent-care,approxie-urgent-care,Ship,P3 — send when contact found,Yes
31,Appsverse,"Maker of consumer privacy apps including a phone-number changer, VPN, and secure browser.","Appsverse wants users to adopt VPN, phone privacy, and secure browser products where they grant network and identity access before protection benefits feel real. First install, permission, and upgrade paths across Phoner and VPN Vault drive daily active use. Upstory could help unify onboarding and permission framing across apps to lift activation on an already large download base.",We believe we can help Appsverse move more installs to an activated first protected action.,Unify the first-run experience across apps.,https://clients.upstory.co/appsverse,appsverse,Ship,P3 — send when contact found,Yes
32,APR,"Airport parking marketplace for prepaid, guaranteed reservations across dozens of airports.","APR is trying to make travelers book parking before they leave home, mirroring how they buy plane tickets and hotel rooms. The checkout and comparison experience is where users commit payment before they know the lot experience will match expectations. Upstory could help APR refine search-to-reservation flows and post-booking reassurance that lift conversion on promotional and valet offers.",We believe we can help APR move more parking searches into prepaid reservations.,Make comparison lead cleanly to checkout.,https://clients.upstory.co/apr,apr,Ship,P2 — send when contact found,Yes
33,Aride,Rideshare app where drivers keep their full fare and riders save through ads and transferable points.,"Aride is trying to win riders and drivers with cheaper fares, ad-driven discounts, and transferable Aride points. The critical experience is booking a trip and paying before the ride completes safely and on time. Upstory could help Aride design rider and driver onboarding, first-ride activation, and in-trip reassurance that supports retention against incumbents.",We believe we can help Aride move more new riders to a completed first trip.,Make the first ride easy to book.,https://clients.upstory.co/aride,aride,Ship,P3 — send when contact found,Yes
34,Artisan Health,"Telehealth service offering immediate-schedule visits with MDs and NPs, transparent pricing, and medication delivery.","Artisan Health wants patients to connect privately with providers in a few clicks without an office visit. The enrollment moment is sharing health needs and payment before treatment outcomes are known. Upstory could help Artisan Health streamline patient onboarding, visit booking, and medication fulfillment UX that improves activation and return visits.",We believe we can help Artisan Health move more new patients from visit booking to completed care.,Make booking an immediate visit simple.,https://clients.upstory.co/artisan-health,artisan-health,Ship,P3 — send when contact found,Yes
35,Assort Health,"AI patient-access platform that answers calls, resolves requests, and schedules healthcare visits.","Assort Health is expanding specialty-specific agentic AI that resolves patient calls and schedules across eighty-four EHR integrations. Patients commit to appointments and care steps before visits occur, so omnichannel intake and scheduling UX drive adoption. Upstory could help Assort Health package patient-facing activation patterns per specialty that providers can launch quickly as Assort scales thousands of sites.",We believe we can help Assort Health increase AI-resolved scheduling intents that become confirmed appointments.,Carry call context into the scheduling handoff.,https://clients.upstory.co/assort-health,assort-health,Ship,P1 — send when contact found,Yes
