#,Company Name,About,Outreach Insight,Headline,Top Opportunity,Brief URL,Slug,Review Status,Notes,OK to send?
382,Loyallt,Platform letting healthcare practices create direct-to-patient prepaid care membership plans.,"LOYALLT is building a direct-to-patient membership layer for dental and adjacent practices, and its roadmap into more specialties suggests they want enrollment flows that feel transparent before patients prepay ongoing care. Upstory could help them sharpen the patient-facing signup and plan-selection experience where families commit to recurring health spend without insurance intermediaries.",We believe we can help Loyallt move more patients from a plan view into an enrolled membership.,Make plan selection lead to enrollment.,https://clients.upstory.co/loyallt,loyallt,Ship,P4 — send when contact found,Yes
383,Lunar Privacy,Enterprise-grade secure communications platform offering data sovereignty without third-party servers.,"Lunar Privacy is selling high-trust secure messaging to organizations that must adopt the platform before they have proof it will protect sensitive communications. An external product partner could help them reduce friction in first-time setup, key exchange, and daily send flows where executives decide whether the product is usable enough to replace incumbent tools.",We believe we can help Lunar Privacy move more organizations from setup into daily secure use.,Make setup lead to a first secure send.,https://clients.upstory.co/lunar-privacy,lunar-privacy,Ship,P3 — send when contact found,Yes
384,MAKChoice,"Luxury marketplace offering concierge access to estates, jets, yachts, and exclusive goods.","MAKChoice is building trust in a luxury marketplace where buyers commit enormous sums before verifying sellers and assets in person. Upstory could help them design the inquiry-to-commitment path where HNW buyers decide whether to proceed, focusing on clarity, verification cues, and human reassurance at the highest-stakes checkout moments.",We believe we can help MAKChoice move more inquiries into committed high-value transactions.,Make inquiry lead to a confident commitment.,https://clients.upstory.co/makchoice,makchoice,Ship,P4 — send when contact found,Yes
385,Manorlead,"Proptech platform combining technology and local expertise for buying, investing, and selling real estate.","Manorlead wants consumers to move from search to major property decisions with more confidence in a modern trading experience. The highest-leverage design work is likely the flows where buyers and sellers commit financially to listings, offers, or agent relationships before closings complete.",We believe we can help Manorlead move more visitors from a search into a committed buyer or seller step.,Make search lead to a committed step.,https://clients.upstory.co/manorlead,manorlead,Ship,P3 — send when contact found,Yes
386,Maratech,Service helping drivers see the total cost of car ownership and make confident vehicle decisions.,Mara is trying to help drivers make one of life's biggest financial decisions with clarity instead of dealership pressure. Upstory could accelerate their ambition by shaping onboarding and decision-support flows where users assemble a full ownership picture and commit to a vehicle path before they have proof the guidance was right.,We believe we can help Maratech move more drivers from research into a confident vehicle decision.,Make research lead to a decision.,https://clients.upstory.co/maratech,maratech,Ship,P4 — send when contact found,Yes
387,Marinalife,Boating marketplace and membership service connecting boaters with marinas and slip booking.,"Marinalife is sustaining a two-sided boating ecosystem where boaters book slips and marinas transact before the on-water experience proves out. With headcount shrinking, they likely need higher conversion on booking and membership enrollment without adding operational drag.",We believe we can help Marinalife move more boaters from a search into a booked slip.,Make slip search lead to a booking.,https://clients.upstory.co/marinalife,marinalife,Ship,P2 — send when contact found,Yes
388,MassagePanda,On-demand marketplace connecting customers with massage therapists for in-home sessions.,"Insufficient signal for a specific angle; fit is on trust category and product description only. MassagePanda's model implies users book in-home therapists and pay before the session, where scheduling clarity and provider trust drive completion.",We believe we can help MassagePanda move more customers from a search into a booked in-home session.,Make booking a session easy.,https://clients.upstory.co/massagepanda,massagepanda,Ship,P4 — send when contact found,Yes
389,MealBets,"School lunch marketplace mobile app connecting students, parents, and vendors for daily meal ordering.",MealBets is trying to make school lunch ordering dependable for parents who choose meals and payment paths before kids are served. Upstory could help them tighten parent onboarding and daily order flows in a mobile context where busy families decide quickly whether to trust a new lunch option.,We believe we can help MealBets move more parents from signup into daily lunch ordering.,Make the first order easy on mobile.,https://clients.upstory.co/mealbets,mealbets,Ship,P3 — send when contact found,Yes
390,MEandMine,"Gamified student wellbeing and SEL platform for schools, counselors, and families.","MEandMine has momentum from recent funding and engineering investment to scale AI-native student wellbeing tools into more schools. They need enrollment and daily check-in experiences that teachers, counselors, and families trust with sensitive child psychological data before interventions are validated.",We believe we can help MEandMine move more classrooms to consistent student check-in routines.,Make the first class check-in teacher-led.,https://clients.upstory.co/meandmine,meandmine,Ship,P1 — send when contact found,Yes
391,Medaici,Patient-centered radiology readings powered by reinforced machine learning.,Medaici is building consumer or provider-facing radiology interpretation where patients and clinicians rely on ML summaries before diagnostic certainty. Upstory could help clarify the intake and results-delivery experience where users commit health data and act on readings prematurely or drop off.,We believe we can help Medaici move more users from a scan upload into a clear reading.,Make scan upload lead to a reading.,https://clients.upstory.co/medaici,medaici,Ship,P3 — send when contact found,Yes
392,MedHe,Consumer health company offering communities and patient engagement tools for chronic conditions.,"MedHelp aims to drive sustainable behavior change for chronic conditions at scale through communities and engagement products. The outreach angle is flows where millions of visitors commit health habits, tracking, or program enrollment before clinical outcomes improve.",We believe we can help MedHe move more visitors into active health tracking or program enrollment.,Make a first visit lead to engagement.,https://clients.upstory.co/medhe,medhe,Ship,P3 — send when contact found,Yes
393,Medigenie,AI platform unifying fragmented pediatric health data for families and providers.,"Medigenie wants families and clinicians to share children's health data across fragmented systems for more coordinated care. If they are rebuilding post headcount collapse, the priority may be proving a trustworthy family onboarding path before care coordination benefits are felt.",We believe we can help Medigenie move more families into a unified pediatric health record.,Make family onboarding lead to a unified record.,https://clients.upstory.co/medigenie,medigenie,Ship,P3 — send when contact found,Yes
394,Mediqal,"AI healthcare platform spanning patient records, documentation, billing, and clinical workflow tools.","Mediqal.ai is pitching hospitals and clinics on AI that touches documentation, billing, and clinical workflows before ROI is proven. Upstory could help them simplify clinician-facing activation where users adopt new tools amid already overloaded EHR routines.",We believe we can help Mediqal move more clinicians into active use of a first AI tool.,Make activation lead to a first tool in use.,https://clients.upstory.co/mediqal,mediqal,Ship,P3 — send when contact found,Yes
395,Medmo,"Medical imaging orchestration platform for referrals, scheduling, insurance verification, and scan adherence.","Medmo has capital and hiring momentum to fix broken imaging workflows for providers and patients who commit to scans before results and follow-on care are known. Upstory could help them polish patient scheduling, insurance verification, and referral-to-scan completion experiences that drive adherence.",We believe we can help Medmo move more imaging referrals to completed scheduled scans.,Carry referral context into scheduling.,https://clients.upstory.co/medmo,medmo,Ship,P1 — send when contact found,Yes
396,Meds,Consumer telehealth and pharmacy platform powering DTC treatment brands and prescription fulfillment.,"Meds.com is scaling fast across telehealth, prescribing, and pharmacy fulfillment where patients submit sensitive health information and treatment choices before medication arrives. Upstory could help them standardize high-converting intake and checkout patterns across new indications and brands as they add headcount.",We believe we can help Meds move more treatment starts to completed prescription checkout.,Standardize intake around treatment confidence.,https://clients.upstory.co/meds,meds,Ship,P1 — send when contact found,Yes
397,Meet YourselfTM,Company combining DNA analysis with neuroscience and psychology for personalized assessment reports.,"Meet Yourself is selling consumers on submitting genetic and personal data before receiving personality insights they treat as meaningful. Upstory could help them design the kit activation, sample submission, and report reveal flows where buyers decide whether the science feels credible enough to complete.",We believe we can help Meet Yourself move more buyers from a kit purchase into a completed report.,Make kit activation lead to a report.,https://clients.upstory.co/meet-yourselftm,meet-yourselftm,Ship,P3 — send when contact found,Yes
398,MegPrime,"Fintech rewarding everyday spending with a digital token, including bill and rent payments.",Insufficient signal for a specific angle; fit is on trust category and product description only. MegPrime asks households to link everyday spending to a tokenized rewards ecosystem before long-term financial value is demonstrated.,We believe we can help MegPrime move more new users into a first token-earning transaction.,Make linking spending lead to a reward.,https://clients.upstory.co/megprime,megprime,Ship,P4 — send when contact found,Yes
399,Memories,Platform for families to curate and safeguard personal stories for generational preservation.,Memories is on a hiring upswing to help families curate and safeguard personal stories they upload before long-term preservation is proven. Upstory could help them design first-upload and sharing flows where users decide how much intimate content to entrust to the platform.,We believe we can help Memories move more families to a first preserved story.,Make the first story easy to capture.,https://clients.upstory.co/memories,memories,Ship,P3 — send when contact found,Yes
400,Merri,"3D event-planning and floorplan product for couples, venues, and hospitality teams.","Merri and Tripleseat want couples and venues to visualize events, book services on demand, and run hospitality sales with less friction. Couples commit deposits and vendor choices before the event executes. Upstory could help refine consumer visualization-to-booking flows and venue-facing reservation UX as Tripleseat scales post-2024 funding.",We believe we can help Merri move more saved floorplans to venue or vendor inquiry.,Make the next action visible from the floorplan.,https://clients.upstory.co/floorplans-by-tripleseat,floorplans-by-tripleseat,Ship,P1 — send when contact found,Yes
401,Meta Search Engine,Privacy-respecting metasearch engine that works across clearnet and Tor without cookies or JavaScript.,Meta Search Engine wants users to route queries through its privacy model before they experience safer browsing outcomes. Upstory could help reduce friction in first-search onboarding and settings where privacy-conscious users decide whether to switch from incumbent search.,We believe we can help Meta Search Engine move more visitors into a first private search.,Make the first search effortless.,https://clients.upstory.co/meta-search-engine,meta-search-engine,Ship,P3 — send when contact found,Yes
402,mettleAI,ML platform predicting relapse risk from behavioral and wearable data for healthcare providers.,mettleAI is equipping providers to act on relapse-risk predictions before patient stability is proven. Upstory could help them shape clinician and patient-facing surfaces where sensitive behavioral data is shared and care plans are adjusted based on algorithmic alerts.,We believe we can help mettleAI move more providers into acting on a first relapse-risk prediction.,Make the first prediction actionable.,https://clients.upstory.co/mettleai,mettleai,Ship,P2 — send when contact found,Yes
403,Mica,"Zero-liability commerce network for merchants, banks, and consumers.",Mica is post-raise and pushing a zero-liability payment network where merchants and consumers commit to transactions before settlement certainty is established. Upstory could help them clarify merchant and consumer activation where credential fraud and settlement anxiety block adoption.,We believe we can help Mica move more merchant prospects to activated payment pilots.,Make pilot readiness visible for merchants.,https://clients.upstory.co/mica,mica,Ship,P1 — send when contact found,Yes
404,Micrdr,Telehealth platform and mobile health unit provider connecting patients to care.,"Micrdr Corp connects patients to telehealth and mobile unit care before clinical results are known. If they are rebuilding after headcount decline, trustworthy patient intake and visit scheduling may be the highest-leverage consumer moment.",We believe we can help Micrdr move more patients from intake into a completed visit.,Make intake lead to a completed visit.,https://clients.upstory.co/micrdr,micrdr,Ship,P3 — send when contact found,Yes
405,Mihygge,"End-to-end platform for senior living and care discovery, lead generation, and vacancy booking.",mihygge is helping families and providers navigate senior living discovery and vacancy booking where placement decisions carry heavy real-world stakes. Upstory could help them design family-facing search and booking flows where loved ones commit to tours and applications before knowing the right care setting.,We believe we can help Mihygge move more families from discovery into a booked tour or application.,Make discovery lead to a booked tour.,https://clients.upstory.co/mihygge,mihygge,Ship,P3 — send when contact found,Yes
406,MintList,AI-powered Canadian used-car marketplace connecting sellers with dealers for fast offers.,"MintList wants consumers to list, receive dealer bids within 24 hours, and complete profitable sell-or-trade transactions before the deal closes. Upstory could help them tighten self-inspection, valuation, and bid-acceptance flows where sellers commit vehicle and financial details early.",We believe we can help MintList move more sellers from a listing into an accepted dealer offer.,Make listing lead to an accepted offer.,https://clients.upstory.co/mintlist,mintlist,Ship,P2 — send when contact found,Yes
407,miPlata,"Dollar wallet for Latino workers offering payroll access, cards, and cross-border transfers.","miPlata has explosive headcount growth while building employer-distributed banking for Latino workers who link pay, cards, and remittances before proving long-term value. Upstory could help them polish worker onboarding where employees connect payroll, activate cards, and send money home in one flow.",We believe we can help miPlata move more workers from onboarding into a first connected payday or transfer.,Make onboarding lead to a first action.,https://clients.upstory.co/miplata,miplata,Ship,P3 — send when contact found,Yes
408,MiraImage,"Encrypted document vault for storing, managing, and accessing personal, business, and legal files.",MiraImage asks users to upload legal and identity-sensitive documents before organized access benefits are realized. Upstory could help them design vault setup and sharing flows where trust in encryption and retrieval is won in the first upload.,We believe we can help MiraImage move more new users to a first securely stored document.,Make the first upload easy.,https://clients.upstory.co/miraimage,miraimage,Ship,P3 — send when contact found,Yes
409,MobexHealth,Configurable virtual care and device-enabled health programs for underserved populations.,MobexHealth sells health systems and agencies on virtual care kits where patients engage remote programs before outcomes improve. Upstory could help them streamline patient activation on MobexHealth Home and Hub where complex populations must trust devices and apps upfront.,We believe we can help MobexHealth move more patients into an activated virtual care program.,Make device-and-app setup lead to activation.,https://clients.upstory.co/mobexhealth,mobexhealth,Ship,P3 — send when contact found,Yes
410,Mobicip,"Parental-control app for managing kids' screen time, content filters, location, and device rules.","Mobicip is optimizing subscription growth for families who install monitoring across children's devices before safety outcomes are assured. Upstory could help them improve parent onboarding, child device linking, and upgrade paths where trust in the product is established in the first session.",We believe we can help Mobicip increase trial families that complete first protected-device setup.,Make the first family rule visible before deeper setup.,https://clients.upstory.co/mobicip,mobicip,Ship,P1 — send when contact found,Yes
411,Model Reno,"Online bathroom and kitchen renovation platform for quoting, visualizing, and ordering remodels.","Model Reno is digitizing renovation planning so homeowners see materials, pricing, and place orders online before contractors enter the home. Upstory could help them reduce drop-off in visualize-to-commit flows where buyers prepay or contract for bathroom and kitchen projects.",We believe we can help Model Reno move more homeowners from a visualization into a committed renovation order.,Make visualizing lead to an order.,https://clients.upstory.co/model-reno,model-reno,Ship,P4 — send when contact found,Yes
412,Molecular You,"Preventive biomarker testing platform with blood-based reports, risk scores, and action plans.","Molecular You just raised and is pushing consumers and clinicians to submit blood draws and deep biomarker data before personalized prevention plans arrive. Upstory could help them design at-home collection, results reveal, and action-plan onboarding where buyers decide whether insights justify the spend.",We believe we can help Molecular You move more test purchasers to completed result-review actions.,Preview the result journey before collection.,https://clients.upstory.co/molecular-you,molecular-you,Ship,P1 — send when contact found,Yes
413,Monarch,"Personal finance app for account tracking, budgeting, investment views, goals, and household collaboration.","Monarch is in aggressive scale mode after recent funding, asking users to link accounts, budgets, and investments before the app proves ongoing value. Upstory could help them sharpen bank-link onboarding and first-week activation where trust in aggregation drives retention.",We believe we can help Monarch move more trials to fully linked first financial views.,Build a useful view before full setup.,https://clients.upstory.co/monarch,monarch,Ship,P1 — send when contact found,Yes
414,Moodmate AI,Real-life mood simulator app helping users improve emotional and mental wellbeing through practice exercises.,Moodmate AI wants users to commit daily mood and mental-health practice routines before sustained wellbeing is demonstrated. Upstory could help them improve first-week activation and exercise completion where users decide whether simulations feel credible enough to continue.,We believe we can help Moodmate AI move more new users into a consistent practice routine.,Make the first exercise lead to a routine.,https://clients.upstory.co/moodmate-ai,moodmate-ai,Ship,P3 — send when contact found,Yes
415,Mortgage Automation Technologies,Borrower-facing mortgage point-of-sale software and digital kiosks for independent mortgage bankers.,Mortgage Automation Technologies asks borrowers to submit financial information and loan applications through web portals and kiosks before mortgage outcomes finalize. Upstory could help streamline borrower application and document upload flows across The BIG Point of Sale platform.,We believe we can help Mortgage Automation Technologies move more borrowers from start into a submitted application.,Make the application lead to submission.,https://clients.upstory.co/mortgage-automation-technologies,mortgage-automation-technologies,Ship,P3 — send when contact found,Yes
416,Moto Nation US,"Mobility technology company providing specialized transportation booking for medical, work, and family travel.",Moto Nation is targeting travelers who book medical and personal trips before journeys complete safely. Upstory could help them design booking and confirmation flows where vulnerable riders commit to providers upfront.,"We believe we can help Moto Nation US move more riders from a request into a booked, confirmed trip.",Make booking a specialized trip easy.,https://clients.upstory.co/moto-nation-us,moto-nation-us,Ship,P3 — send when contact found,Yes
417,MotoStream,"Peer-to-peer car-sharing platform with AI inspections, connecting vehicle owners and renters across Africa and Asia.",MotoStream needs renters and owners to trust AI verification and peer vehicle handoffs before trips prove satisfactory. Upstory could help them polish renter onboarding and pre-trip inspection flows in markets where P2P mobility is still emerging.,We believe we can help MotoStream move more renters from a vehicle view into a confirmed booking.,Make the booking feel secure.,https://clients.upstory.co/motostream,motostream,Ship,P3 — send when contact found,Yes
418,Moveline,Moving platform letting people video their belongings to get guaranteed quotes and book movers.,"Moveline asks movers to record belongings and accept guaranteed pricing before possessions are transported. Upstory could help them reduce anxiety in video capture, quote acceptance, and mover selection where customers commit high-value inventory early.",We believe we can help Moveline move more customers from a video capture into a booked move.,Make video capture lead to a booking.,https://clients.upstory.co/moveline,moveline,Ship,P2 — send when contact found,Yes
419,Mozio,Ground transportation booking platform for airport transfers and travel-brand integrations.,"Mozio powers pre-booked ground transportation for airlines, hotels, and OTAs where travelers pay before rides occur. Upstory could help them improve traveler booking and payment completion on embedded widgets where trust in unfamiliar local providers drives conversion.",We believe we can help Mozio move more transfer searches to confirmed prepaid rides.,Make provider confidence visible before checkout.,https://clients.upstory.co/mozio,mozio,Ship,P1 — send when contact found,Yes
420,MSKai,Clinical decision-support technology assisting real-time musculoskeletal treatment pathway decisions.,MSKai is asking clinicians to rely on real-time MSK data for pathway decisions before patient outcomes improve. Upstory could help them design clinician-facing workflows where care teams commit to AI-informed routing with clear human oversight.,We believe we can help MSKai move more clinicians into acting on AI-informed pathway decisions.,Make the first decision clear.,https://clients.upstory.co/mskai,mskai,Ship,P3 — send when contact found,Yes
421,Mundaly Health,Community health coverage model tying diaspora-funded plans to school attendance and clinic visits.,Mundaly Health is scaling a community health model where families pay annual coverage and commit to participation behaviors before health outcomes improve. Upstory could help them clarify enrollment and adherence touchpoints for diaspora funders and local families.,We believe we can help Mundaly Health move more families from enrollment into active participation.,Make enrollment lead to participation.,https://clients.upstory.co/mundaly-health,mundaly-health,Ship,P3 — send when contact found,Yes
422,My Best Step,Service matching people seeking addiction treatment to transparent recovery paths.,Insufficient signal for a specific angle; fit is on trust category and product description only. My Best Step's stated goal is transparent treatment matching where people commit to care paths before knowing provider fit or cost.,We believe we can help My Best Step move more people from a search into a matched recovery path.,Make matching lead to a connection.,https://clients.upstory.co/my-best-step,my-best-step,Ship,P4 — send when contact found,Yes
